<?xml version="1.0" encoding="ISO-8859-1"?>
<?xml-stylesheet type="text/xsl" href="zoo.xsl"?>
<!DOCTYPE zoo SYSTEM "zoo.dtd" [
<!ENTITY % notations SYSTEM "notations.ent">
%notations;
<!ENTITY flipper.jpg SYSTEM "flipper.jpg" NDATA jpg>
<!ENTITY oum.jpg SYSTEM "oum.jpg" NDATA jpg>
<!ENTITY ecco.jpg SYSTEM "ecco.jpg" NDATA jpg>
]>

<zoo>
	<info>Ouvert de 6h18 a 18h25</info>
	<info><img src="nourrir.gif" />Il est <b>interdit</b> de nourrir les animaux&#127;&#128;.</info>
	
	<aquarium>
		<mammifères-marins>
			<dauphins>
				<dauphin id="a424242" photo="flipper.jpg" date-naissance="2013-01-01">
					<nom> Flipper </nom>
					<sexe> M </sexe>
					<taille unité="cm"> 240 </taille>
					<poids unité="kg"> 120 </poids>
				</dauphin>
				
				<dauphin id="z696969" photo="ecco.jpg" date-naissance="2012-06-15">
					<nom> Ecco </nom>
					<sexe> F </sexe>
					<taille unité="cm"> 202 </taille>
					<poids unité="kg"> 101 </poids>
				</dauphin>
				
				<dauphin id="r000007" photo="oum.jpg" date-naissance="2011-07-07">
					<nom> Oum </nom>
					<sexe> F </sexe>
					<taille unité="cm"> 150 </taille>
					<poids	unité="kg" status="mesure approximative"> 60 </poids>			
				</dauphin>	
			</dauphins>
		</mammifères-marins>
		<poissons>
			<sélaciens>
				<danger>Il est interdit de <b>nager</b> avec les requins</danger>
				<requin id="t1092001" espèce="marteau" date-naissance="1991-12-12">
					<nom>Oussama</nom>
					<sexe>M</sexe>
					 <taille unité="cm">455</taille>
					 <poids unité="kg">540</poids>
					 <commentaire>A tendance a se jeter contre les murs
						<![CDATA[<<< marteau & cinglé !!! >>>]]>
							<!-- Il faudra bien le faire piquer un jour -->
					 </commentaire>
				</requin>
				
				<requin id="vgyuh43" espèce="requin bleu" nom-savant="carcharias glaucus" date-naissance="2004-01-13">
					<nom>Saddam</nom>
					<sexe>M</sexe>
					<taille unité="cm">355</taille>
					<poids unité="kg" status="">425</poids>
				</requin>
			</sélaciens>
		</poissons>	
	</aquarium>
</zoo>
